Name,Category,Effect
Smooth Rock,Hold items,A Pokémon held item that extends the duration of the move Sandstorm used by the holder.
Snorlium Z,Hold items,"Allows Snorlax to upgrade Giga Impact to a Z-Move, Pulverizing Pancake."
Snowball,Hold items,Raises Attack if hit by an Ice-type move.
Soda Pop,Medicine,Restores 50 HP.
Soft Sand,Hold items,Increases the power of Ground-type moves.
Solganium Z,Hold items,"Allows Solgaleo to upgrade Sunsteel Strike to a Z-Move, Searing Sunraze Smash."
Soothe Bell,Hold items,An item to be held by a Pokémon. It is a bell with a comforting chime that calms the holder and makes it friendly.
Soul Dew,Hold items,Increases the power of Psychic- and Dragon-type moves when held by Latios or Latias. Increases Sp.Atk/Sp.Def prior to Gen 7.
Spell Tag,Hold items,Increases the power of Ghost-type moves.
Spelon Berry,Berries,A Berry which is very rare in the Unova region. A maniac will buy it for a high price.
Spice Mix,General items,One of the many ingredients that can be used for cooking at your camp. There are over fifty spices contained within this ingredient’s hot flavor.
Splash Plate,Hold items,Increases power of Water-type moves. Changes Arceus' type to Water.
Spooky Plate,Hold items,Increases power of Ghost-type moves. Changes Arceus' type to Ghost.
Sport Ball,Pokeballs,A special Poké Ball for the Bug-Catching Contest.
Sprinklotad,General items,"A watering can shaped like a Lotad. It helps promote the healthy growth of any Berries planted in good, soft soil."
Stable Mulch,General items,A fertilizer to be spread on soft soil in regions where Berries are grown. A maniac will buy it for a high price.
Star Piece,General items,A shard of a pretty gem that sparkles in a red color. It can be sold at a high price to shops.
Star Sweet,Hold items,Evolves Milcery into Star Flavor Alcremie.
Stardust,General items,"Lovely, red-colored sand with a loose, silky feel. It can be sold at a high price to shops."
Starf Berry,Berries,Sharply raises a random stat when HP is low.
Steel Gem,Hold items,Increases the power of a Steel-type move only once.
Steel Memory,Hold items,Changes Silvally and its move Multi-Attack to Steel type.
Steelium Z,Hold items,"Allows the use of Corkscrew Crash, the Steel type Z-Move."
Steelixite,Hold items,Enables Steelix to Mega Evolve during battle.
Sticky Barb,Hold items,A held item that damages the holder on every turn. It may latch on to foes and allies that touch the holder.
Stone Plate,Hold items,Increases power of Rock-type moves. Changes Arceus' type to Rock.
Strange Souvenir,General items,An ornament depicting a Pokémon that is venerated as a protector in some region far from Kalos.
Strawberry Sweet,Hold items,Evolves Milcery into Strawberry Flavor Alcremie.
Stretchy Spring,General items,
Sun Stone,General items,Evolves certain species of Pokémon.
Super Lure,General items,Attracts Pokémon in the wild.
Super Potion,Medicine,Restores 60 HP.
Super Repel,General items,An item that prevents weak wild Pokémon from appearing for 200 steps after its use.
Swampertite,Hold items,Enables Swampert to Mega Evolve during battle.
Sweet Apple,Hold items,Evolves Applin into Appletun.
Sweet Heart,Medicine,Very sweet chocolate. It restores the HP of one Pokémon by only 20 points.
Swift Wing,Medicine,Increases Speed EVs by 1.
Tamato Berry,Berries,Increases Friendship but lowers Speed EVs.
Tanga Berry,Berries,Weakens a supereffective Bug-type attack against the holding Pokémon.
Tapunium Z,Hold items,"Allows the Tapus to upgrade Nature's Madness to a Z-Move, Guardian of Alola."
Tart Apple,Hold items,Evolves Applin into Flapple.
Terrain Extender,Hold items,An item to be held by a Pokémon. It extends the duration of the terrain caused by the holder's move or Ability.
Thick Club,Hold items,Increases Attack when held by Cubone or Marowak.
Throat Spray,Hold items,Raises Sp. Atk when a sound-based move is used.
Thunder Stone,General items,Evolves certain species of Pokémon.
Timer Ball,Pokeballs,A somewhat different BALL that becomes progressively better the more turns there are in a battle.
Timid Mint,Battle items,Changes the Pokémon's stats to match the Timid nature.
Tin of Beans,General items,"One of the many ingredients that can be used for cooking at your camp. When simmered, the beans suffuse a dish with their mild flavor."
Tiny Mushroom,General items,A small and rare mushroom. It is sought after by collectors.
TMV Pass,General items,A commuter pass that allows the holder to ride the TMV between Lumiose City and Kiloude City at any time.
Tough Candy,Medicine,Increases a Pokémon's Defense stat by 1.
Tough Candy L,Medicine,Increases a Pokémon's Defense stat.
Tough Candy XL,Medicine,Increases a Pokémon's Defense stat.
Toxic Orb,Hold items,An item to be held by a Pokémon. It is a bizarre orb that badly poisons the holder in battle.
Toxic Plate,Hold items,Increases power of Poison-type moves. Changes Arceus' type to Poison.
Tropical Shell,General items,
Twisted Spoon,Hold items,Increases the power of Psychic-type moves.
Tyranitarite,Hold items,Enables Tyranitar to Mega Evolve during battle.
Ultra Ball,Pokeballs,An ultra-performance Ball that provides a higher Pokémon catch rate than a Great Ball.
Ultranecrozium Z,Hold items,"Allows Ultra Necrozma to upgrade Photon Geyser to a Z-Move, Light That Burns the Sky."
Upgrade,General items,Evolves Porygon when traded holding the item.
Utility Umbrella,Hold items,An item to be held by a Pokémon. This sturdy umbrella protects the holder from the effects of weather.
Venusaurite,Hold items,Enables Venusaur to Mega Evolve during battle.
Wacan Berry,Berries,Weakens a supereffective Electric-type attack against the holding Pokémon.
Water Gem,Hold items,Increases the power of a Water-type move only once.
Water Memory,Hold items,Changes Silvally and its move Multi-Attack to Water type.
Water Stone,General items,Evolves certain species of Pokémon.
Waterium Z,Hold items,"Allows the use of Hydro Vortex, the Water type Z-Move."
Watmel Berry,Berries,A Berry which is very rare in the Unova region. A maniac will buy it for a high price.
Wave Incense,Hold items,Increases the power of Water-type moves. Breeding Mantine produces Mantyke when held.
Weakness Policy,Hold items,Sharply raises Attack and Special Attack if hit by a super-effective move.
Wepear Berry,Berries,A Berry which is very rare in the Unova region. A maniac will buy it for a high price.
Whipped Dream,General items,Evolves Swirlix when traded holding the item.
White Apricorn,General items,A white Apricorn. It doesn't smell like anything.
White Flute,General items,A toy flute made from white glass. A maniac will buy it for a high price.
White Herb,Hold items,An item to be held by a POKéMON. It restores any lowered stat in battle. It can be used only once.
Wide Lens,Hold items,Increases the accuracy of moves.
Wiki Berry,Berries,"Restores HP if it's low, but may cause confusion."
Wise Glasses,Hold items,Increases the power of Special-category moves.
Wishing Piece,General items,Activates a Pokémon Den for a Max Raid Battle.
X Accuracy,Battle items,Raises Accuracy of a Pokémon in battle.
X Accuracy 2,Battle items,Sharply raises Accuracy of a Pokémon in battle.
X Accuracy 3,Battle items,Drastically raises Accuracy of a Pokémon in battle.
X Accuracy 6,Battle items,Immensely raises Accuracy of a Pokémon in battle.
X Attack,Battle items,Raises Attack of a Pokémon in battle.
X Attack 2,Battle items,Sharply raises Attack of a Pokémon in battle.
X Attack 3,Battle items,Drastically raises Attack of a Pokémon in battle.
X Attack 6,Battle items,Immensely raises Attack of a Pokémon in battle.
X Defense,Battle items,Raises Defense of a Pokémon in battle.
X Defense 2,Battle items,Sharply raises Defense of a Pokémon in battle.
X Defense 3,Battle items,Drastically raises Defense of a Pokémon in battle.
X Defense 6,Battle items,Immensely raises Defense of a Pokémon in battle.
X Sp. Atk,Battle items,Raises Special Attack of a Pokémon in battle.
X Sp. Atk 2,Battle items,Sharply raises Special Attack of a Pokémon in battle.
X Sp. Atk 3,Battle items,Drastically raises Special Attack of a Pokémon in battle.
X Sp. Atk 6,Battle items,Immensely raises Special Attack of a Pokémon in battle.
X Sp. Def,Battle items,Raises Special Defense of a Pokémon in battle.
X Sp. Def 2,Battle items,Sharply raises Special Defense of a Pokémon in battle.
X Sp. Def 3,Battle items,Drastically raises Special Defense of a Pokémon in battle.
X Sp. Def 6,Battle items,Immensely raises Special Defense of a Pokémon in battle.
X Speed,Battle items,Raises Speed of a Pokémon in battle.
X Speed 2,Battle items,Sharply raises Speed of a Pokémon in battle.
X Speed 3,Battle items,Drastically raises Speed of a Pokémon in battle.
X Speed 6,Battle items,Immensely raises Speed of a Pokémon in battle.
Yache Berry,Berries,Weakens a supereffective Ice-type attack against the holding Pokémon.
Yellow Apricorn,General items,A yellow Apricorn. It has an invigorating scent.
Yellow Flute,General items,A toy flute made from yellow glass. A maniac will buy it for a high price.
Yellow Nectar,Hold items,A flower nectar obtained at Melemele Meadow. It changes the form of certain species of Pokémon.
Yellow Scarf,General items,Raises holder's Tough aspect in a Contest.
Yellow Shard,General items,A small yellow shard. It appears to be from some sort of implement made long ago.
Zap Plate,Hold items,Increases power of Electric-type moves. Changes Arceus' type to Electric.
Zinc,Medicine,Increases Special Defense EVs by 10.
Zoom Lens,Hold items,Raises a move's accuracy if the holder moves after its target.